{
  "$schema": "https://json-schema.org/draft/2020-12/schema",
  "$id": "https://oridesign.local/schemas/m0f/neg-layer-contact-coverage-candidate-bundle-ledger-v1.schema.json",
  "title": "NEG-LAYER-CONTACT-COVERAGE exact-negative candidate bundle ledger v1",
  "type": "object",
  "additionalProperties": false,
  "required": [
    "schemaVersion",
    "schemaId",
    "recordType",
    "contractStatus",
    "scientificClaim",
    "vectorSetId",
    "scope",
    "declaredCoplanarContactLayerIntervalCoverageParserOnly",
    "canonicalManifestPath",
    "canonicalManifestRegistration",
    "canonicalPromotionClaimed",
    "canonicalContactFixtureComplete",
    "contactInferenceIncluded",
    "supportProfileIncluded",
    "toleranceProfileIncluded",
    "physicalLayerOrderEstablished",
    "orderReversalEvidenceIncluded",
    "contactCompletenessEstablished",
    "contactLegalityEstablished",
    "pathContinuityEstablished",
    "continuousCollisionDetectionIncluded",
    "collisionDetectionIncluded",
    "collisionFreedomEstablished",
    "certificateHashVerificationIncluded",
    "cryptographicAuthenticityEstablished",
    "foldabilityEstablished",
    "scientificVerificationClaimed",
    "globalM0fGate",
    "caseCount",
    "artifactCount",
    "generator",
    "provenance",
    "cases",
    "artifacts"
  ],
  "properties": {
    "schemaVersion": { "const": 1 },
    "schemaId": {
      "const": "https://oridesign.local/schemas/m0f/neg-layer-contact-coverage-candidate-bundle-ledger-v1.schema.json"
    },
    "recordType": { "const": "m0f-neg-layer-contact-coverage-candidate-bundle-ledger" },
    "contractStatus": { "const": "candidate" },
    "scientificClaim": { "const": false },
    "vectorSetId": { "const": "NEG-LAYER-CONTACT-COVERAGE-V1" },
    "scope": {
      "const": "project-authored-exact-negative-artifact-contract-declared-coplanar-contact-layer-interval-coverage-parser-replay-only"
    },
    "declaredCoplanarContactLayerIntervalCoverageParserOnly": { "const": true },
    "canonicalManifestPath": { "const": "tests/fixtures/manifest.json" },
    "canonicalManifestRegistration": { "const": "not-registered" },
    "canonicalPromotionClaimed": { "const": false },
    "canonicalContactFixtureComplete": { "const": false },
    "contactInferenceIncluded": { "const": false },
    "supportProfileIncluded": { "const": false },
    "toleranceProfileIncluded": { "const": false },
    "physicalLayerOrderEstablished": { "const": false },
    "orderReversalEvidenceIncluded": { "const": false },
    "contactCompletenessEstablished": { "const": false },
    "contactLegalityEstablished": { "const": false },
    "pathContinuityEstablished": { "const": false },
    "continuousCollisionDetectionIncluded": { "const": false },
    "collisionDetectionIncluded": { "const": false },
    "collisionFreedomEstablished": { "const": false },
    "certificateHashVerificationIncluded": { "const": false },
    "cryptographicAuthenticityEstablished": { "const": false },
    "foldabilityEstablished": { "const": false },
    "scientificVerificationClaimed": { "const": false },
    "globalM0fGate": { "const": "not-evaluated" },
    "caseCount": { "const": 1 },
    "artifactCount": { "const": 3 },
    "generator": {
      "const": {
        "generatorId": "oridesign-neg-layer-contact-coverage-candidate-bundle",
        "generatorVersion": "1.0.0-candidate",
        "serialization": "stable-json-utf8-lf-v1",
        "detector": "parseArtifactContractV1",
        "detectorSourcePath": "m0f/artifacts/contract.ts"
      }
    },
    "provenance": {
      "const": {
        "sourceReferenceId": "oridesign-neg-layer-contact-coverage-candidate-v1",
        "sourceKind": "project-authored",
        "title": "NEG-LAYER-CONTACT-COVERAGE project-authored declared contact layer-interval coverage parser vector",
        "authors": ["OriDesign contributors"],
        "redistribution": "allowed",
        "licenseSpdx": "MIT"
      }
    },
    "cases": {
      "type": "array",
      "minItems": 1,
      "maxItems": 1,
      "prefixItems": [
        {
          "const": {
            "caseIndex": 0,
            "caseId": "NEG-LAYER-CONTACT-COVERAGE",
            "controlArtifactId": "control-fold",
            "mutationKind": "delay-declared-layer-relation-start-within-continuous-contact",
            "changedPaths": ["$.layerEvents[0].interval[0]"],
            "sourceArtifactId": "source-layer-contact-coverage",
            "sourcePath": "layer-contact-coverage.json",
            "expectedOutcome": "rejected",
            "expectedIssues": [
              { "path": "$.layerEvents", "code": "incomplete-layer-contact-coverage" }
            ]
          }
        }
      ],
      "items": false
    },
    "artifacts": {
      "type": "array",
      "minItems": 3,
      "maxItems": 3,
      "prefixItems": [
        { "$ref": "#/$defs/readmeArtifact" },
        { "$ref": "#/$defs/controlArtifact" },
        { "$ref": "#/$defs/sourceArtifact" }
      ],
      "items": false
    }
  },
  "$defs": {
    "readmeArtifact": {
      "type": "object",
      "additionalProperties": false,
      "required": [
        "artifactId",
        "role",
        "path",
        "mediaType",
        "sha256",
        "licenseSpdx",
        "provenance"
      ],
      "properties": {
        "artifactId": { "const": "bundle-readme" },
        "role": { "const": "readme" },
        "path": { "const": "README.md" },
        "mediaType": { "const": "text/markdown; charset=utf-8" },
        "sha256": { "type": "string", "pattern": "^sha256:[0-9a-f]{64}$" },
        "licenseSpdx": { "const": "MIT" },
        "provenance": {
          "const": {
            "sourceReferenceId": "oridesign-neg-layer-contact-coverage-candidate-v1",
            "sourceUse": "project-authored",
            "derivation": "authored",
            "dependsOnArtifactIds": []
          }
        }
      }
    },
    "controlArtifact": {
      "type": "object",
      "additionalProperties": false,
      "required": [
        "artifactId",
        "role",
        "path",
        "mediaType",
        "sha256",
        "licenseSpdx",
        "provenance"
      ],
      "properties": {
        "artifactId": { "const": "control-fold" },
        "role": { "const": "accepted-control" },
        "path": { "const": "control-fold.json" },
        "mediaType": { "const": "application/json" },
        "sha256": { "type": "string", "pattern": "^sha256:[0-9a-f]{64}$" },
        "licenseSpdx": { "const": "MIT" },
        "provenance": {
          "const": {
            "sourceReferenceId": "oridesign-neg-layer-contact-coverage-candidate-v1",
            "sourceUse": "project-authored",
            "derivation": "authored",
            "dependsOnArtifactIds": []
          }
        }
      }
    },
    "sourceArtifact": {
      "type": "object",
      "additionalProperties": false,
      "required": [
        "artifactId",
        "role",
        "path",
        "mediaType",
        "sha256",
        "licenseSpdx",
        "provenance"
      ],
      "properties": {
        "artifactId": { "const": "source-layer-contact-coverage" },
        "role": { "const": "negative-source" },
        "path": { "const": "layer-contact-coverage.json" },
        "mediaType": { "const": "application/json" },
        "sha256": { "type": "string", "pattern": "^sha256:[0-9a-f]{64}$" },
        "licenseSpdx": { "const": "MIT" },
        "provenance": {
          "const": {
            "sourceReferenceId": "oridesign-neg-layer-contact-coverage-candidate-v1",
            "sourceUse": "project-authored",
            "derivation": "mutated-from-control",
            "dependsOnArtifactIds": ["control-fold"]
          }
        }
      }
    }
  }
}
