{"artifactCount":3,"artifacts":[{"artifactId":"bundle-readme","licenseSpdx":"MIT","mediaType":"text/markdown; charset=utf-8","path":"README.md","provenance":{"dependsOnArtifactIds":[],"derivation":"authored","sourceReferenceId":"oridesign-neg-layer-contact-coverage-candidate-v1","sourceUse":"project-authored"},"role":"readme","sha256":"sha256:bb7b27639b6c840ed437075327a3dd0c2c5b2025eadd3389cead1cc79d965f0c"},{"artifactId":"control-fold","licenseSpdx":"MIT","mediaType":"application/json","path":"control-fold.json","provenance":{"dependsOnArtifactIds":[],"derivation":"authored","sourceReferenceId":"oridesign-neg-layer-contact-coverage-candidate-v1","sourceUse":"project-authored"},"role":"accepted-control","sha256":"sha256:e20b49a9f73fde3005a64e9ad7c7b41cc11638f6d6d67e09a725d41249c7e94f"},{"artifactId":"source-layer-contact-coverage","licenseSpdx":"MIT","mediaType":"application/json","path":"layer-contact-coverage.json","provenance":{"dependsOnArtifactIds":["control-fold"],"derivation":"mutated-from-control","sourceReferenceId":"oridesign-neg-layer-contact-coverage-candidate-v1","sourceUse":"project-authored"},"role":"negative-source","sha256":"sha256:307ffecc79973d6b1a65dd407886d7d884f625de87cfd91aab837cc869c0a4b8"}],"canonicalContactFixtureComplete":false,"canonicalManifestPath":"tests/fixtures/manifest.json","canonicalManifestRegistration":"not-registered","canonicalPromotionClaimed":false,"caseCount":1,"cases":[{"caseId":"NEG-LAYER-CONTACT-COVERAGE","caseIndex":0,"changedPaths":["$.layerEvents[0].interval[0]"],"controlArtifactId":"control-fold","expectedIssues":[{"code":"incomplete-layer-contact-coverage","path":"$.layerEvents"}],"expectedOutcome":"rejected","mutationKind":"delay-declared-layer-relation-start-within-continuous-contact","sourceArtifactId":"source-layer-contact-coverage","sourcePath":"layer-contact-coverage.json"}],"certificateHashVerificationIncluded":false,"collisionDetectionIncluded":false,"collisionFreedomEstablished":false,"contactCompletenessEstablished":false,"contactInferenceIncluded":false,"contactLegalityEstablished":false,"continuousCollisionDetectionIncluded":false,"contractStatus":"candidate","cryptographicAuthenticityEstablished":false,"declaredCoplanarContactLayerIntervalCoverageParserOnly":true,"foldabilityEstablished":false,"generator":{"detector":"parseArtifactContractV1","detectorSourcePath":"m0f/artifacts/contract.ts","generatorId":"oridesign-neg-layer-contact-coverage-candidate-bundle","generatorVersion":"1.0.0-candidate","serialization":"stable-json-utf8-lf-v1"},"globalM0fGate":"not-evaluated","orderReversalEvidenceIncluded":false,"pathContinuityEstablished":false,"physicalLayerOrderEstablished":false,"provenance":{"authors":["OriDesign contributors"],"licenseSpdx":"MIT","redistribution":"allowed","sourceKind":"project-authored","sourceReferenceId":"oridesign-neg-layer-contact-coverage-candidate-v1","title":"NEG-LAYER-CONTACT-COVERAGE project-authored declared contact layer-interval coverage parser vector"},"recordType":"m0f-neg-layer-contact-coverage-candidate-bundle-ledger","schemaId":"https://oridesign.local/schemas/m0f/neg-layer-contact-coverage-candidate-bundle-ledger-v1.schema.json","schemaVersion":1,"scientificClaim":false,"scientificVerificationClaimed":false,"scope":"project-authored-exact-negative-artifact-contract-declared-coplanar-contact-layer-interval-coverage-parser-replay-only","supportProfileIncluded":false,"toleranceProfileIncluded":false,"vectorSetId":"NEG-LAYER-CONTACT-COVERAGE-V1"}
